{
    "schema_version": 1,
    "defaults": {
        "deployment_config": {
            "bin_dir": "/opt",
            "ready_timeout": 2.0,
            "shutdown_timeout": 2.0,
            "ready_recovery_action": {
                "restart": {
                    "number_of_attempts": 0
                }
            },
            "recovery_action": {
                "switch_run_target": {
                    "run_target": "Startup"
                }
            },
            "environmental_variables": {
                "LD_LIBRARY_PATH": "/opt/lib"
            },
            "sandbox": {
                "uid": 0,
                "gid": 0,
                "scheduling_policy": "SCHED_OTHER",
                "scheduling_priority": 0
            }
        },
        "component_properties": {
            "application_profile": {
                "application_type": "Reporting",
                "is_self_terminating": false,
                "alive_supervision": {
                    "reporting_cycle": 0.1,
                    "min_indications": 1,
                    "max_indications": 3,
                    "failed_cycles_tolerance": 1
                }
            },
            "ready_condition": {
                "process_state": "Running"
            }
        }
    },
    "components": {
        "control_daemon": {
            "component_properties": {
                "binary_name": "control_app/control_daemon",
                "application_profile": {
                    "application_type": "State_Manager",
                    "alive_supervision": {
                        "min_indications": 0
                    }
                }
            },
            "deployment_config": {
                "ready_timeout": 1.0,
                "shutdown_timeout": 1.0,
                "environmental_variables": {
                    "PROCESSIDENTIFIER": "control_daemon",
                    "SCORE_LCM_INSTANCE_SPECIFIER": "StateManager/LaunchManager/Instance"
                }
            }
        },
        "cpp_supervised_app": {
            "component_properties": {
                "binary_name": "supervision_demo/cpp_supervised_app",
                "application_profile": {
                    "application_type": "Reporting_And_Supervised"
                },
                "process_arguments": [
                    "-d50"
                ]
            },
            "deployment_config": {
                "environmental_variables": {
                    "PROCESSIDENTIFIER": "cpp_supervised_app",
                    "CONFIG_PATH": "/opt/supervision_demo/etc/hmproc_cpp_supervised_app.bin",
                    "IDENTIFIER": "cpp_supervised_app"
                }
            }
        },
        "rust_supervised_app": {
            "component_properties": {
                "binary_name": "supervision_demo/rust_supervised_app",
                "application_profile": {
                    "application_type": "Reporting_And_Supervised"
                },
                "process_arguments": [
                    "-d50"
                ]
            },
            "deployment_config": {
                "environmental_variables": {
                    "PROCESSIDENTIFIER": "rust_supervised_app",
                    "CONFIG_PATH": "/opt/supervision_demo/etc/hmproc_rust_supervised_app.bin",
                    "IDENTIFIER": "rust_supervised_app"
                }
            }
        },
        "lifecycle_app": {
            "component_properties": {
                "binary_name": "cpp_lifecycle_app/cpp_lifecycle_app"
            },
            "deployment_config": {
                "environmental_variables": {
                    "PROCESSIDENTIFIER": "lifecycle_app"
                }
            }
        },
        "fallback_app": {
            "component_properties": {
                "binary_name": "cpp_lifecycle_app/cpp_lifecycle_app",
                "process_arguments": [
                    "-v"
                ]
            },
            "deployment_config": {
                "environmental_variables": {
                    "PROCESSIDENTIFIER": "fallback_app"
                }
            }
        }
    },
    "run_targets": {
        "Startup": {
            "depends_on": [
                "control_daemon"
            ],
            "recovery_action": {
                "switch_run_target": {
                    "run_target": "fallback_run_target"
                }
            }
        },
        "Running": {
            "depends_on": [
                "control_daemon",
                "cpp_supervised_app",
                "rust_supervised_app",
                "lifecycle_app"
            ],
            "recovery_action": {
                "switch_run_target": {
                    "run_target": "fallback_run_target"
                }
            }
        }
    },
    "initial_run_target": "Startup",
    "alive_supervision": {
        "evaluation_cycle": 0.05
    },
    "fallback_run_target": {
        "depends_on": [
            "control_daemon",
            "fallback_app"
        ]
    }
}